[
  {
    "message_id": "8b4a4320-a831-435c-8022-93a26647a8cf",
    "group_hash": "05f2d6f9d346f2148b70f0c72f90c2d1",
    "author_hash": "e8c7aef919a7e36676d9d9d57bf05ba0",
    "timestamp": "2026-03-08T09:02:00-03:00",
    "message_type": "media_sticker",
    "char_count": 0,
    "word_count": 0,
    "has_mention": false,
    "mentioned_hashes": [],
    "has_url": false,
    "is_edited": false,
    "source_platform": "android",
    "seq_in_group": 1,
    "parser_version": "1.0.0"
  },
  {
    "message_id": "2354d8a6-ad0e-41fb-be74-034ef9a5a06c",
    "group_hash": "05f2d6f9d346f2148b70f0c72f90c2d1",
    "author_hash": "781cf4bac3e72c1fc1275023028b8ccf",
    "timestamp": "2026-03-08T09:05:00-03:00",
    "message_type": "text",
    "char_count": 280,
    "word_count": 46,
    "has_mention": false,
    "mentioned_hashes": [],
    "has_url": false,
    "is_edited": true,
    "source_platform": "android",
    "seq_in_group": 2,
    "parser_version": "1.0.0"
  },
  {
    "message_id": "67bdf4e6-e97a-4f04-b1cb-f578d1963e0a",
    "group_hash": "05f2d6f9d346f2148b70f0c72f90c2d1",
    "author_hash": "9c678dcc61bc12aeb76b4be3ca62032f",
    "timestamp": "2026-03-08T09:06:00-03:00",
    "message_type": "text",
    "char_count": 280,
    "word_count": 46,
    "has_mention": false,
    "mentioned_hashes": [],
    "has_url": false,
    "is_edited": false,
    "source_platform": "android",
    "seq_in_group": 3,
    "parser_version": "1.0.0"
  },
  {
    "message_id": "673c79a6-f8c3-4c35-a8fc-78dd177485bb",
    "group_hash": "05f2d6f9d346f2148b70f0c72f90c2d1",
    "author_hash": "6001b387b2d768915540082b723736ba",
    "timestamp": "2026-03-08T09:11:00-03:00",
    "message_type": "text",
    "char_count": 143,
    "word_count": 23,
    "has_mention": false,
    "mentioned_hashes": [],
    "has_url": false,
    "is_edited": false,
    "source_platform": "android",
    "seq_in_group": 4,
    "parser_version": "1.0.0"
  },
  {
    "message_id": "8cb7fba4-d32a-409f-845b-3d2416e2c13c",
    "group_hash": "05f2d6f9d346f2148b70f0c72f90c2d1",
    "author_hash": "6001b387b2d768915540082b723736ba",
    "timestamp": "2026-03-08T09:10:00-03:00",
    "message_type": "text",
    "char_count": 177,
    "word_count": 29,
    "has_mention": false,
    "mentioned_hashes": [],
    "has_url": false,
    "is_edited": false,
    "source_platform": "ios",
    "seq_in_group": 5,
    "parser_version": "1.0.0"
  },
  {
    "message_id": "ec701cbe-750e-4980-a280-d6c251644e31",
    "group_hash": "05f2d6f9d346f2148b70f0c72f90c2d1",
    "author_hash": "781cf4bac3e72c1fc1275023028b8ccf",
    "timestamp": "2026-03-08T09:15:00-03:00",
    "message_type": "media_video",
    "char_count": 0,
    "word_count": 0,
    "has_mention": false,
    "mentioned_hashes": [],
    "has_url": false,
    "is_edited": false,
    "source_platform": "android",
    "seq_in_group": 6,
    "parser_version": "1.0.0"
  },
  {
    "message_id": "35920664-732a-4536-8d6e-ad5d0cae9e4f",
    "group_hash": "05f2d6f9d346f2148b70f0c72f90c2d1",
    "author_hash": "9c678dcc61bc12aeb76b4be3ca62032f",
    "timestamp": "2026-03-08T09:16:00-03:00",
    "message_type": "media_video",
    "char_count": 0,
    "word_count": 0,
    "has_mention": false,
    "mentioned_hashes": [],
    "has_url": false,
    "is_edited": false,
    "source_platform": "ios",
    "seq_in_group": 7,
    "parser_version": "1.0.0"
  },
  {
    "message_id": "476af1f0-7b1b-4654-8931-2078f60b61d8",
    "group_hash": "05f2d6f9d346f2148b70f0c72f90c2d1",
    "author_hash": "9c678dcc61bc12aeb76b4be3ca62032f",
    "timestamp": "2026-03-08T09:16:00-03:00",
    "message_type": "contact_card",
    "char_count": 0,
    "word_count": 0,
    "has_mention": false,
    "mentioned_hashes": [],
    "has_url": false,
    "is_edited": false,
    "source_platform": "android",
    "seq_in_group": 8,
    "parser_version": "1.0.0"
  },
  {
    "message_id": "b12e58ad-7f8f-4e39-a8c1-4014b79075c1",
    "group_hash": "05f2d6f9d346f2148b70f0c72f90c2d1",
    "author_hash": null,
    "timestamp": "2026-03-08T09:18:00-03:00",
    "message_type": "system",
    "char_count": 0,
    "word_count": 0,
    "has_mention": false,
    "mentioned_hashes": [],
    "has_url": false,
    "is_edited": false,
    "source_platform": "ios",
    "seq_in_group": 9,
    "parser_version": "1.0.0"
  },
  {
    "message_id": "c78ec102-9af6-4c4a-b1d3-ddbf5b564faf",
    "group_hash": "05f2d6f9d346f2148b70f0c72f90c2d1",
    "author_hash": "e8c7aef919a7e36676d9d9d57bf05ba0",
    "timestamp": "2026-03-08T09:23:00-03:00",
    "message_type": "text",
    "char_count": 233,
    "word_count": 38,
    "has_mention": false,
    "mentioned_hashes": [],
    "has_url": false,
    "is_edited": false,
    "source_platform": "android",
    "seq_in_group": 10,
    "parser_version": "1.0.0"
  },
  {
    "message_id": "5283e844-713b-469a-90a4-6f4fe6ad3c06",
    "group_hash": "05f2d6f9d346f2148b70f0c72f90c2d1",
    "author_hash": "06259ffb1d3ae69add4c1e7176dba5a1",
    "timestamp": "2026-03-08T09:22:00-03:00",
    "message_type": "text",
    "char_count": 274,
    "word_count": 45,
    "has_mention": false,
    "mentioned_hashes": [],
    "has_url": false,
    "is_edited": false,
    "source_platform": "ios",
    "seq_in_group": 11,
    "parser_version": "1.0.0"
  },
  {
    "message_id": "c8eb5715-66e2-44b3-bafa-2053a80d37fb",
    "group_hash": "05f2d6f9d346f2148b70f0c72f90c2d1",
    "author_hash": "55953b08c0a172bf6a1af0f4bde68706",
    "timestamp": "2026-03-08T09:26:00-03:00",
    "message_type": "media_sticker",
    "char_count": 0,
    "word_count": 0,
    "has_mention": false,
    "mentioned_hashes": [],
    "has_url": false,
    "is_edited": false,
    "source_platform": "android",
    "seq_in_group": 12,
    "parser_version": "1.0.0"
  },
  {
    "message_id": "20255699-bab0-4d2b-8ca0-67c4f5303d23",
    "group_hash": "05f2d6f9d346f2148b70f0c72f90c2d1",
    "author_hash": "5f8f4e4ecfed3515da006ecd26d76836",
    "timestamp": "2026-03-08T09:28:00-03:00",
    "message_type": "text",
    "char_count": 138,
    "word_count": 23,
    "has_mention": false,
    "mentioned_hashes": [],
    "has_url": true,
    "is_edited": false,
    "source_platform": "android",
    "seq_in_group": 13,
    "parser_version": "1.0.0"
  },
  {
    "message_id": "08aa2cdb-b0bd-45d0-b4cb-3c60684e9634",
    "group_hash": "05f2d6f9d346f2148b70f0c72f90c2d1",
    "author_hash": "35b52e2b49e38b41b054a4f182b39695",
    "timestamp": "2026-03-08T09:29:00-03:00",
    "message_type": "contact_card",
    "char_count": 0,
    "word_count": 0,
    "has_mention": false,
    "mentioned_hashes": [],
    "has_url": false,
    "is_edited": false,
    "source_platform": "ios",
    "seq_in_group": 14,
    "parser_version": "1.0.0"
  },
  {
    "message_id": "68421ee5-345b-4ad4-999e-9c9fd48ec4b9",
    "group_hash": "05f2d6f9d346f2148b70f0c72f90c2d1",
    "author_hash": "e8c7aef919a7e36676d9d9d57bf05ba0",
    "timestamp": "2026-03-08T09:31:00-03:00",
    "message_type": "text",
    "char_count": 72,
    "word_count": 12,
    "has_mention": false,
    "mentioned_hashes": [],
    "has_url": false,
    "is_edited": false,
    "source_platform": "ios",
    "seq_in_group": 15,
    "parser_version": "1.0.0"
  },
  {
    "message_id": "5cb97581-2afa-4957-831e-0f8d985cf898",
    "group_hash": "05f2d6f9d346f2148b70f0c72f90c2d1",
    "author_hash": "6001b387b2d768915540082b723736ba",
    "timestamp": "2026-03-08T09:35:00-03:00",
    "message_type": "media_audio",
    "char_count": 0,
    "word_count": 0,
    "has_mention": false,
    "mentioned_hashes": [],
    "has_url": false,
    "is_edited": false,
    "source_platform": "ios",
    "seq_in_group": 16,
    "parser_version": "1.0.0"
  },
  {
    "message_id": "53ca9fb5-8b6e-42a9-8c54-9f46709e7096",
    "group_hash": "05f2d6f9d346f2148b70f0c72f90c2d1",
    "author_hash": "781cf4bac3e72c1fc1275023028b8ccf",
    "timestamp": "2026-03-08T09:37:00-03:00",
    "message_type": "text",
    "char_count": 25,
    "word_count": 4,
    "has_mention": false,
    "mentioned_hashes": [],
    "has_url": false,
    "is_edited": false,
    "source_platform": "android",
    "seq_in_group": 17,
    "parser_version": "1.0.0"
  },
  {
    "message_id": "8707a567-9395-465e-ac8a-18d4bfa41c13",
    "group_hash": "05f2d6f9d346f2148b70f0c72f90c2d1",
    "author_hash": "5f8f4e4ecfed3515da006ecd26d76836",
    "timestamp": "2026-03-08T09:36:00-03:00",
    "message_type": "media_gif",
    "char_count": 0,
    "word_count": 0,
    "has_mention": false,
    "mentioned_hashes": [],
    "has_url": false,
    "is_edited": false,
    "source_platform": "ios",
    "seq_in_group": 18,
    "parser_version": "1.0.0"
  },
  {
    "message_id": "5602e1d5-31b9-4576-9ee8-22710cf2c707",
    "group_hash": "05f2d6f9d346f2148b70f0c72f90c2d1",
    "author_hash": "55953b08c0a172bf6a1af0f4bde68706",
    "timestamp": "2026-03-08T09:40:00-03:00",
    "message_type": "text",
    "char_count": 59,
    "word_count": 9,
    "has_mention": false,
    "mentioned_hashes": [],
    "has_url": false,
    "is_edited": false,
    "source_platform": "ios",
    "seq_in_group": 19,
    "parser_version": "1.0.0"
  },
  {
    "message_id": "aab533ee-c36a-4f02-9742-8cfc15d6a322",
    "group_hash": "05f2d6f9d346f2148b70f0c72f90c2d1",
    "author_hash": "e8c7aef919a7e36676d9d9d57bf05ba0",
    "timestamp": "2026-03-08T09:40:00-03:00",
    "message_type": "media_sticker",
    "char_count": 0,
    "word_count": 0,
    "has_mention": false,
    "mentioned_hashes": [],
    "has_url": false,
    "is_edited": false,
    "source_platform": "ios",
    "seq_in_group": 20,
    "parser_version": "1.0.0"
  },
  {
    "message_id": "de9bea78-aca0-4268-bf89-8c5719f16da0",
    "group_hash": "05f2d6f9d346f2148b70f0c72f90c2d1",
    "author_hash": "55953b08c0a172bf6a1af0f4bde68706",
    "timestamp": "2026-03-08T09:45:00-03:00",
    "message_type": "text",
    "char_count": 135,
    "word_count": 22,
    "has_mention": false,
    "mentioned_hashes": [],
    "has_url": false,